{"$schema":"https://json-schema.org/draft/2020-12/schema","$id":"urn:bildr:harness.expert-response.v1","title":"BILDR expert response v1","type":"object","additionalProperties":false,"required":["schema","response_id","request_id","run_id","snapshot_id","snapshot_revision","completed_at","no_direct_action","verdict","summary","recommendation","evidence_refs"],"properties":{"schema":{"const":"harness.expert-response.v1"},"response_id":{"type":"string","minLength":1,"maxLength":128},"request_id":{"type":"string","minLength":1,"maxLength":128},"run_id":{"type":"string","minLength":1,"maxLength":128},"snapshot_id":{"type":"string","minLength":1,"maxLength":128},"snapshot_revision":{"type":"integer","minimum":1},"completed_at":{"type":"string","format":"date-time"},"no_direct_action":{"const":true},"verdict":{"type":"string","enum":["recommendation","insufficient_evidence","human_input_required","replan_required","no_change"]},"summary":{"type":"string","minLength":1,"maxLength":4000},"recommendation":{"type":"string","minLength":1,"maxLength":8000},"evidence_refs":{"type":"array","minItems":1,"maxItems":100,"items":{"type":"string","minLength":1,"maxLength":128}}}}